{
  "$schema": "./runic.release.schema.json",
  "schemaVersion": 1,
  "policy": {
    "noForwardingPackages": true,
    "finalDeprecationRelease": true,
    "archivedProductsAreNotReleaseBearing": true
  },
  "repositories": [
    {
      "id": "application",
      "currentIdentity": "runic-toolkit",
      "v02Identity": "runic-application",
      "githubRepository": "https://github.com/Runic-Artifex/runic-toolkit",
      "attestationWorkflow": "Runic-Artifex/runic-toolkit/.github/workflows/public-release.yml"
    },
    {
      "id": "desktop",
      "currentIdentity": "runic-desktop",
      "v02Identity": "runic-desktop",
      "githubRepository": "https://github.com/Runic-Artifex/runic-desktop",
      "attestationWorkflow": "Runic-Artifex/runic-desktop/.github/workflows/public-release.yml"
    },
    {
      "id": "command-line",
      "currentIdentity": "runic-command-line",
      "v02Identity": "runic-command-line",
      "githubRepository": "https://github.com/Runic-Artifex/runic-command-line",
      "attestationWorkflow": "Runic-Artifex/runic-command-line/.github/workflows/public-release.yml"
    },
    {
      "id": "assets",
      "currentIdentity": "runic-assets",
      "v02Identity": "runic-assets",
      "githubRepository": "https://github.com/Runic-Artifex/runic-assets",
      "attestationWorkflow": "Runic-Artifex/runic-assets/.github/workflows/public-release.yml"
    },
    {
      "id": "translations",
      "currentIdentity": "runic-translations",
      "v02Identity": "runic-translations",
      "githubRepository": "https://github.com/Runic-Artifex/runic-translations",
      "attestationWorkflow": "Runic-Artifex/runic-translations/.github/workflows/public-release.yml"
    },
    {
      "id": "translations-editor",
      "currentIdentity": "runic-translations-editor",
      "v02Identity": "runic-translations-editor",
      "githubRepository": "https://github.com/Runic-Artifex/runic-translations-editor",
      "attestationWorkflow": "Runic-Artifex/runic-translations-editor/.github/workflows/public-release.yml"
    },
    {
      "id": "flow",
      "currentIdentity": "runic-flow",
      "v02Identity": "runic-flow",
      "githubRepository": "https://github.com/Runic-Artifex/runic-flow",
      "attestationWorkflow": "Runic-Artifex/runic-flow/.github/workflows/public-release.yml"
    },
    {
      "id": "svelte",
      "currentIdentity": "runic-svelte",
      "v02Identity": "runic-application",
      "githubRepository": "https://github.com/Runic-Artifex/runic-svelte",
      "attestationWorkflow": "Runic-Artifex/runic-svelte/.github/workflows/public-release.yml"
    },
    {
      "id": "vite",
      "currentIdentity": "runic-vite",
      "v02Identity": "runic-application",
      "githubRepository": "https://github.com/Runic-Artifex/runic-vite",
      "attestationWorkflow": "Runic-Artifex/runic-vite/.github/workflows/public-release.yml"
    },
    {
      "id": "examples",
      "currentIdentity": "runic-toolkit-examples",
      "v02Identity": "runic-examples",
      "githubRepository": "https://github.com/Runic-Artifex/runic-toolkit-examples",
      "attestationWorkflow": "Runic-Artifex/runic-toolkit-examples/.github/workflows/public-release.yml"
    },
    {
      "id": "docs",
      "currentIdentity": "runic-docs",
      "v02Identity": "runic-docs",
      "githubRepository": "https://github.com/Runic-Artifex/runic-docs",
      "attestationWorkflow": "Runic-Artifex/runic-docs/.github/workflows/public-release.yml"
    },
    {
      "id": "release-automation",
      "currentIdentity": "Runic-Artifex/.github",
      "v02Identity": "Runic-Artifex/.github",
      "githubRepository": "https://github.com/Runic-Artifex/.github",
      "attestationWorkflow": "Runic-Artifex/.github/.github/workflows/public-release.yml"
    },
    {
      "id": "brand",
      "currentIdentity": "runic-brand",
      "v02Identity": "runic-brand",
      "githubRepository": "https://github.com/Runic-Artifex/runic-brand",
      "attestationWorkflow": "Runic-Artifex/runic-brand/.github/workflows/public-release.yml"
    }
  ],
  "products": [
    {
      "id": "application",
      "stableOwner": "Runic Application",
      "repository": "application",
      "support": "supported",
      "documentation": {
        "state": "available",
        "path": "/products/runic-application/"
      }
    },
    {
      "id": "desktop",
      "stableOwner": "Runic Desktop",
      "repository": "desktop",
      "support": "supported",
      "documentation": {
        "state": "available",
        "path": "/products/runic-desktop/"
      }
    },
    {
      "id": "command-line",
      "stableOwner": "Runic Command Line",
      "repository": "command-line",
      "support": "supported",
      "documentation": {
        "state": "available",
        "path": "/products/runic-command-line/"
      }
    },
    {
      "id": "assets",
      "stableOwner": "Runic Assets",
      "repository": "assets",
      "support": "supported",
      "documentation": {
        "state": "available",
        "path": "/products/runic-assets/"
      }
    },
    {
      "id": "translations",
      "stableOwner": "Runic Translations",
      "repository": "translations",
      "support": "supported",
      "documentation": {
        "state": "available",
        "path": "/products/runic-translations/"
      }
    },
    {
      "id": "flow",
      "stableOwner": "Runic Flow",
      "repository": "flow",
      "support": "archived",
      "documentation": {
        "state": "available",
        "path": "/products/runic-flow/"
      },
      "archive": {
        "status": "archived",
        "evidence": {
          "repository": "flow",
          "revision": "54782e00e85574b1f99cd81ef51958613226ca6a",
          "path": "docs/adr/0002-v02-operations-probation-archive.md"
        }
      }
    },
    {
      "id": "svelte",
      "stableOwner": "Runic Svelte",
      "repository": "svelte",
      "support": "supported",
      "documentation": {
        "state": "pending",
        "path": null
      }
    },
    {
      "id": "vite",
      "stableOwner": "Runic Vite",
      "repository": "vite",
      "support": "supported",
      "documentation": {
        "state": "pending",
        "path": null
      }
    },
    {
      "id": "editor",
      "stableOwner": "Runic Translations Editor",
      "repository": "translations-editor",
      "support": "supported",
      "documentation": {
        "state": "available",
        "path": "/products/runic-translations-editor/"
      }
    },
    {
      "id": "release-automation",
      "stableOwner": "Release Automation",
      "repository": "release-automation",
      "support": "supported",
      "documentation": {
        "state": "available",
        "path": "/releases/"
      }
    }
  ],
  "canonicalPackages": [
    {
      "identity": "Runic.Application",
      "ecosystem": "nuget",
      "installKind": "nuget-package",
      "product": "application",
      "state": "approved"
    },
    {
      "identity": "Runic.Application.Bridge",
      "ecosystem": "nuget",
      "installKind": "nuget-package",
      "product": "application",
      "state": "approved"
    },
    {
      "identity": "Runic.Application.Desktop",
      "ecosystem": "nuget",
      "installKind": "nuget-package",
      "product": "application",
      "state": "approved"
    },
    {
      "identity": "Runic.Application.Hosting",
      "ecosystem": "nuget",
      "installKind": "nuget-package",
      "product": "application",
      "state": "approved"
    },
    {
      "identity": "Runic.Application.Testing",
      "ecosystem": "nuget",
      "installKind": "nuget-package",
      "product": "application",
      "state": "approved"
    },
    {
      "identity": "Runic.Application.Templates",
      "ecosystem": "nuget",
      "installKind": "dotnet-template",
      "product": "application",
      "state": "approved"
    },
    {
      "identity": "dotnet-runic",
      "ecosystem": "nuget",
      "installKind": "dotnet-tool",
      "product": "application",
      "state": "approved"
    },
    {
      "identity": "Runic.CommandLine",
      "ecosystem": "nuget",
      "installKind": "nuget-package",
      "product": "command-line",
      "state": "approved"
    },
    {
      "identity": "Runic.CommandLine.Processes",
      "ecosystem": "nuget",
      "installKind": "nuget-package",
      "product": "command-line",
      "state": "approved"
    },
    {
      "identity": "Runic.CommandLine.Testing",
      "ecosystem": "nuget",
      "installKind": "nuget-package",
      "product": "command-line",
      "state": "approved"
    },
    {
      "identity": "Runic.Assets",
      "ecosystem": "nuget",
      "installKind": "nuget-package",
      "product": "assets",
      "state": "approved"
    },
    {
      "identity": "Runic.Assets.AspNetCore",
      "ecosystem": "nuget",
      "installKind": "nuget-package",
      "product": "assets",
      "state": "approved"
    },
    {
      "identity": "Runic.Assets.Desktop",
      "ecosystem": "nuget",
      "installKind": "nuget-package",
      "product": "assets",
      "state": "approved"
    },
    {
      "identity": "Runic.Translations",
      "ecosystem": "nuget",
      "installKind": "nuget-package",
      "product": "translations",
      "state": "approved"
    },
    {
      "identity": "Runic.Translations.Tooling",
      "ecosystem": "nuget",
      "installKind": "nuget-package",
      "product": "translations",
      "state": "approved"
    },
    {
      "identity": "Runic.Translations.Build",
      "ecosystem": "nuget",
      "installKind": "nuget-package",
      "product": "translations",
      "state": "approved"
    },
    {
      "identity": "dotnet-runic-translations",
      "ecosystem": "nuget",
      "installKind": "dotnet-tool",
      "product": "translations",
      "state": "approved"
    },
    {
      "identity": "Runic.Translations.Templates",
      "ecosystem": "nuget",